### ISSUE TITLE
tun2socks not working with archlinux(4.16.5-1-ARCH)

### ISSUE THREAD

**Issue by zfl9** [ambrop72/badvpn#64]
> My English is not very good, most of them are translated from Google, sorry.

I will first briefly describe the details of installing and running tun2socks.

Operating System: ArchLinux
```bash
$ uname -a
Linux arch 4.16.5-1-ARCH #1 SMP PREEMPT Thu Apr 26 16:53:40 UTC 2018 x86_64 GNU/Linux
```
According to the wiki, I use the `compile-tun2socks.sh` script to compile tun2socks（Installed gcc）
```bash
$ SRCDIR=. OUTDIR=/usr/local/bin CC=gcc ENDIAN=little ./compile-tun2socks.sh
# exit code: 0
# exec file: /usr/local/bin/tun2socks
```
Then add the tun NIC and configure the IP address (via iproute2)
```bash
$ ip tuntap add dev tun0 mode tun user root
$ ip addr add dev tun0 10.0.0.1/24
$ ip link set dev tun0 up
```
Socks5 proxy listening address `0.0.0.0:1080`.
Use the `curl` test to make sure it is working:
```bash
$ curl -x socks5://127.0.0.1:1080 https://www.google.com
<HTML><HEAD><meta http-equiv="content-type" content="text/html;charset=utf-8">
<TITLE>302 Moved</TITLE></HEAD><BODY>
<H1>302 Moved</H1>
The document has moved
<A HREF="http://www.google.com.hk/url?sa=p&amp;hl=zh-CN&amp;pref=hkredirect&amp;pval=yes&amp;q=http://www.google.com.hk/%3Fgws_rd%3Dcr&amp;ust=1525152708616013&amp;usg=AOvVaw1OdJJ0m3VlpCtBN7PjkyMz">here</A>.
</BODY></HTML>
```
ok, now socks5(via openssh) proxy is working.
Then I started running tun2socks with the following details:
```bash
$ tun2socks --tundev tun0 --netif-ipaddr 10.0.0.2 --netif-netmask 255.255.255.0 --socks-server-addr 127.0.0.1:1080
NOTICE(tun2socks): initializing BadVPN tun2socks 1.999.130
NOTICE(tun2socks): entering event loop
```
It looks like it works, then I try to ping the 10.0.0.1, 10.0.0.2 address
```bash
$ ping -c2 10.0.0.1
PING 10.0.0.1 (10.0.0.1) 56(84) bytes of data.
64 bytes from 10.0.0.1: icmp_seq=1 ttl=64 time=0.105 ms
64 bytes from 10.0.0.1: icmp_seq=2 ttl=64 time=0.135 ms

$ ping -c2 10.0.0.2
PING 10.0.0.2 (10.0.0.2) 56(84) bytes of data.
64 bytes from 10.0.0.2: icmp_seq=1 ttl=255 time=0.150 ms
64 bytes from 10.0.0.2: icmp_seq=2 ttl=255 time=0.230 ms
```
It seems to work fine, and then when I try to use `curl` to connect to the `tun0` NIC, it returns a `connection timeout` error:
```bash
# Use normal network card (ens33)
$ curl -I --interface ens33 https://github.com
HTTP/1.1 200 OK
Server: GitHub.com
Date: Tue, 01 May 2018 05:44:40 GMT
Content-Type: text/html; charset=utf-8
Status: 200 OK
Cache-Control: no-cache
Vary: X-PJAX
Set-Cookie: logged_in=no; domain=.github.com; path=/; expires=Sat, 01 May 2038 05:44:40 -0000; secure; HttpOnly
Set-Cookie: _gh_sess=aEoyRDFUL2MyQkt1SEZlREVya1FsVFlKY2JpbFl1Mjl5QkZIU0txUUd6USt4Z3luRkJTRTJsUlo5ZzZJVVN1dzFHZmpXdHVsQkFlbGxObi9ZNXlNN3pPVHpMcnBOdkZZVk9vdGwrd0RZcGMxYTBIczhubGpqN2U5aEZNZ0ZWQThtenNnaWJCbE1USTNCUTZVNUlQZzVpWDBBSjBBUUphQWQvQzNxOXFjbXJJbGtXTjZmblYvNUNlSEJkVk80YlZRLS1CemtZbStZSDM3N0VpcEx0c2M5QXl3PT0%3D--4d4927d62b1acea77cced425411b2fbe9cce4944; path=/; secure; HttpOnly
X-Request-Id: 95b8cc95-30a8-45e6-8ecc-7ef1dd5c1f09
X-Runtime: 0.043846
Strict-Transport-Security: max-age=31536000; includeSubdomains; preload
X-Frame-Options: deny
X-Content-Type-Options: nosniff
X-XSS-Protection: 1; mode=block
Referrer-Policy: origin-when-cross-origin, strict-origin-when-cross-origin
Expect-CT: max-age=2592000, report-uri="https://api.github.com/_private/browser/errors"
Content-Security-Policy: default-src 'none'; base-uri 'self'; block-all-mixed-content; connect-src 'self' uploads.github.com status.github.com collector.githubapp.com api.github.com www.google-analytics.com github-cloud.s3.amazonaws.com github-production-repository-file-5c1aeb.s3.amazonaws.com github-production-upload-manifest-file-7fdce7.s3.amazonaws.com github-production-user-asset-6210df.s3.amazonaws.com wss://live.github.com; font-src assets-cdn.github.com; form-action 'self' github.com gist.github.com; frame-ancestors 'none'; frame-src render.githubusercontent.com; img-src 'self'data: assets-cdn.github.com identicons.github.com collector.githubapp.com github-cloud.s3.amazonaws.com *.githubusercontent.com; manifest-src 'self'; media-src 'none'; script-src assets-cdn.github.com; style-src 'unsafe-inline' assets-cdn.github.com
X-Runtime-rack: 0.050077
X-GitHub-Request-Id: 49D5:02D3:8C9A43:120AF10:5AE7FEC7

# Use tun network card (tun0)
$ curl -I --interface tun0 https://github.com
curl: (7) Failed to connect to github.com port 443: Connection timed out
```
At this point `tun2socks` doesn't have any output, then I try to change loglevel to 5(debug) and return infinite loop error (information)
```bash
$ tun2socks --tundev tun0 --netif-ipaddr 10.0.0.2 --netif-netmask 255.255.255.0 --socks-server-addr 127.0.0.1:1080 --loglevel 5
NOTICE(tun2socks): initializing BadVPN tun2socks 1.999.130
DEBUG(BReactor): Reactor initializing
DEBUG(BSignal): BSignal initializing
NOTICE(tun2socks): entering event loop
DEBUG(BReactor): Entering event loop
DEBUG(tun2socks): lwip init
DEBUG(tun2socks): netif func init
DEBUG(BReactor): Calling epoll_wait
DEBUG(BReactor): epoll_wait timed out
DEBUG(BReactor): Dispatching timer
DEBUG(tun2socks): TCP timer
DEBUG(BReactor): Calling epoll_wait
DEBUG(BReactor): epoll_wait timed out
DEBUG(BReactor): Dispatching timer
DEBUG(tun2socks): TCP timer
DEBUG(BReactor): Calling epoll_wait
DEBUG(BReactor): epoll_wait timed out
DEBUG(BReactor): Dispatching timer
......
```
I tried to replace the kernel version. I suspect that the archlinux kernel version is too new, but still does not work after the replacement.

I thought this was an example, and then I found a companion, he is also using archlinux, the steps are the same, and the result is the same.

However, strangely enough, I followed the same steps and worked properly in CentOS 7.3. Similarly, after cross-compilation, it worked fine on Android (7.1.2). This is incredible!

**I need help. Can anyone tell me how to solve this problem? Thank you very much!**

**Comment by ambrop72** [comment]
Hi,
From the log output it seems like packets are not getting routed into the tun interface, please check your routing table and/or do a packet capture on that interface.

**Comment by zfl9** [comment]
Thanks Reply.

`ping -c4 10.0.0.1`, no packet is captured.
```bash
$ ping -c4 10.0.0.1
PING 10.0.0.1 (10.0.0.1) 56(84) bytes of data.
64 bytes from 10.0.0.1: icmp_seq=1 ttl=253 time=4.47 ms
64 bytes from 10.0.0.1: icmp_seq=2 ttl=253 time=4.36 ms
64 bytes from 10.0.0.1: icmp_seq=3 ttl=253 time=4.43 ms
64 bytes from 10.0.0.1: icmp_seq=4 ttl=253 time=4.42 ms

$ tcpdump -i tun0 -Annvvv
tcpdump: listening on tun0, link-type RAW (Raw IP), capture size 262144 bytes
```

`ping -c4 10.0.0.2`, some packets are captured.
```bash
$ ping -c4 10.0.0.2
PING 10.0.0.2 (10.0.0.2) 56(84) bytes of data.
64 bytes from 10.0.0.2: icmp_seq=1 ttl=255 time=0.178 ms
64 bytes from 10.0.0.2: icmp_seq=2 ttl=255 time=0.186 ms
64 bytes from 10.0.0.2: icmp_seq=3 ttl=255 time=0.191 ms
64 bytes from 10.0.0.2: icmp_seq=4 ttl=255 time=0.197 ms

$ tcpdump -i tun0 -Annvvv
tcpdump: listening on tun0, link-type RAW (Raw IP), capture size 262144 bytes
08:20:04.648490 IP (tos 0x0, ttl 64, id 30996, offset 0, flags [DF], proto ICMP (1), length 84)
    10.0.0.1 > 10.0.0.2: ICMP echo request, id 21202, seq 1, length 64
E..Ty.@.@...
...
.....4!R......Z......	..................... !"#$%&'()*+,-./01234567
08:20:04.648633 IP (tos 0x0, ttl 255, id 30996, offset 0, flags [DF], proto ICMP (1), length 84)
    10.0.0.2 > 10.0.0.1: ICMP echo reply, id 21202, seq 1, length 64
E..Ty.@.....
...
.....<!R......Z......	..................... !"#$%&'()*+,-./01234567
08:20:05.653325 IP (tos 0x0, ttl 64, id 31221, offset 0, flags [DF], proto ICMP (1), length 84)
    10.0.0.1 > 10.0.0.2: ICMP echo request, id 21202, seq 2, length 64
E..Ty.@.@...
...
.....X.R......Z......	..................... !"#$%&'()*+,-./01234567
08:20:05.653468 IP (tos 0x0, ttl 255, id 31221, offset 0, flags [DF], proto ICMP (1), length 84)
    10.0.0.2 > 10.0.0.1: ICMP echo reply, id 21202, seq 2, length 64
E..Ty.@.....
...
.....`.R......Z......	..................... !"#$%&'()*+,-./01234567
08:20:06.667122 IP (tos 0x0, ttl 64, id 31418, offset 0, flags [DF], proto ICMP (1), length 84)
    10.0.0.1 > 10.0.0.2: ICMP echo request, id 21202, seq 3, length 64
E..Tz.@.@...
...
.....s.R......Z.....-
..................... !"#$%&'()*+,-./01234567
08:20:06.667268 IP (tos 0x0, ttl 255, id 31418, offset 0, flags [DF], proto ICMP (1), length 84)
    10.0.0.2 > 10.0.0.1: ICMP echo reply, id 21202, seq 3, length 64
E..Tz.@.....
...
.....{.R......Z.....-
..................... !"#$%&'()*+,-./01234567
08:20:07.680033 IP (tos 0x0, ttl 64, id 31579, offset 0, flags [DF], proto ICMP (1), length 84)
    10.0.0.1 > 10.0.0.2: ICMP echo request, id 21202, seq 4, length 64
E..T{[@.@..K
...
.......R......Z....3`
..................... !"#$%&'()*+,-./01234567
08:20:07.680184 IP (tos 0x0, ttl 255, id 31579, offset 0, flags [DF], proto ICMP (1), length 84)
    10.0.0.2 > 10.0.0.1: ICMP echo reply, id 21202, seq 4, length 64
E..T{[@....J
...
.......R......Z....3`
..................... !"#$%&'()*+,-./01234567
^C
8 packets captured
8 packets received by filter
0 packets dropped by kernel
```

`curl --interface tun0 https://ip.cn/`, some packets are captured.
```bash
$ curl --interface tun0 https://ip.cn/
^C

$ tcpdump -i tun0 -Annvvv
tcpdump: listening on tun0, link-type RAW (Raw IP), capture size 262144 bytes
08:21:47.027491 IP (tos 0x0, ttl 64, id 44649, offset 0, flags [DF], proto TCP (6), length 60)
    10.0.0.1.27344 > 198.41.215.88.443: Flags [S], cksum 0xb267 (correct), seq 48473509, win 29200, options [mss 1460,sackOK,TS val 2318982326 ecr 0,nop,wscale 9], length 0
E..<.i@.@...
....).Xj.............r..g.........
.8.........
08:21:47.027786 IP (tos 0x0, ttl 255, id 15, offset 0, flags [none], proto TCP (6), length 44)
    198.41.215.88.443 > 10.0.0.1.27344: Flags [S.], cksum 0xa39a (correct), seq 8468, ack 48473510, win 5840, options [mss 1460], length 0
E..,.......:.).X
.....j...!.....`...........
08:21:48.053263 IP (tos 0x0, ttl 64, id 44650, offset 0, flags [DF], proto TCP (6), length 60)
    10.0.0.1.27344 > 198.41.215.88.443: Flags [S], cksum 0xae66 (correct), seq 48473509, win 29200, options [mss 1460,sackOK,TS val 2318983351 ecr 0,nop,wscale 9], length 0
E..<.j@.@...
....).Xj.............r..f.........
.8.........
08:21:48.053462 IP (tos 0x0, ttl 255, id 16, offset 0, flags [none], proto TCP (6), length 44)
    198.41.215.88.443 > 10.0.0.1.27344: Flags [S.], cksum 0xa39a (correct), seq 8468, ack 48473510, win 5840, options [mss 1460], length 0
E..,.......9.).X
.....j...!.....`...........
08:21:49.688828 IP (tos 0x0, ttl 255, id 17, offset 0, flags [none], proto TCP (6), length 44)
    198.41.215.88.443 > 10.0.0.1.27344: Flags [S.], cksum 0xa39a (correct), seq 8468, ack 48473510, win 5840, options [mss 1460], length 0
E..,.......8.).X
.....j...!.....`...........
08:21:50.189177 IP (tos 0x0, ttl 64, id 44651, offset 0, flags [DF], proto TCP (6), length 60)
    10.0.0.1.27344 > 198.41.215.88.443: Flags [S], cksum 0xa611 (correct), seq 48473509, win 29200, options [mss 1460,sackOK,TS val 2318985484 ecr 0,nop,wscale 9], length 0
E..<.k@.@...
....).Xj.............r............
.8.........
08:21:50.189425 IP (tos 0x0, ttl 255, id 18, offset 0, flags [none], proto TCP (6), length 44)
    198.41.215.88.443 > 10.0.0.1.27344: Flags [S.], cksum 0xa39a (correct), seq 8468, ack 48473510, win 5840, options [mss 1460], length 0
E..,.......7.).X
.....j...!.....`...........
08:21:54.240541 IP (tos 0x0, ttl 64, id 7667, offset 0, flags [DF], proto TCP (6), length 60)
    10.0.0.1.46232 > 104.16.25.88.443: Flags [S], cksum 0xbfe3 (correct), seq 3429501363, win 29200, options [mss 1460,sackOK,TS val 3609470731 ecr0,nop,wscale 9], length 0
E..<..@.@..`
...h..X.....j	.......r............
.$'........
08:21:54.240729 IP (tos 0x0, ttl 255, id 19, offset 0, flags [none], proto TCP (6), length 44)
    104.16.25.88.443 > 10.0.0.1.46232: Flags [S.], cksum 0x421d (correct), seq 10062, ack 3429501364, win 5840, options [mss 1460], length 0
E..,......0Ph..X
.........'N.j	.`...B.......
08:21:55.253726 IP (tos 0x0, ttl 64, id 7668, offset 0, flags [DF], proto TCP (6), length 60)
    10.0.0.1.46232 > 104.16.25.88.443: Flags [S], cksum 0xbbf4 (correct), seq 3429501363, win 29200, options [mss 1460,sackOK,TS val 3609471738 ecr0,nop,wscale 9], length 0
E..<..@.@.._
...h..X.....j	.......r............
.$*........
08:21:55.253964 IP (tos 0x0, ttl 255, id 20, offset 0, flags [none], proto TCP (6), length 44)
    104.16.25.88.443 > 10.0.0.1.46232: Flags [S.], cksum 0x421d (correct), seq 10062, ack 3429501364, win 5840, options [mss 1460], length 0
E..,......0Oh..X
.........'N.j	.`...B.......
08:21:57.235019 IP (tos 0x0, ttl 255, id 21, offset 0, flags [none], proto TCP (6), length 44)
    104.16.25.88.443 > 10.0.0.1.46232: Flags [S.], cksum 0x421d (correct), seq 10062, ack 3429501364, win 5840, options [mss 1460], length 0
E..,......0Nh..X
.........'N.j	.`...B.......
08:21:57.440848 IP (tos 0x0, ttl 64, id 7669, offset 0, flags [DF], proto TCP (6), length 60)
    10.0.0.1.46232 > 104.16.25.88.443: Flags [S], cksum 0xb374 (correct), seq 3429501363, win 29200, options [mss 1460,sackOK,TS val 3609473914 ecr0,nop,wscale 9], length 0
E..<..@.@..^
...h..X.....j	.......r..t.........
.$3z.......
08:21:57.441048 IP (tos 0x0, ttl 255, id 22, offset 0, flags [none], proto TCP (6), length 44)
    104.16.25.88.443 > 10.0.0.1.46232: Flags [S.], cksum 0x421d (correct), seq 10062, ack 3429501364, win 5840, options [mss 1460], length 0
E..,......0Mh..X
.........'N.j	.`...B.......
08:22:01.494332 IP (tos 0x0, ttl 64, id 27927, offset 0, flags [DF], proto TCP (6), length 60)
    10.0.0.1.63350 > 198.41.214.88.443: Flags [S], cksum 0x2ffc (correct), seq 2874962391, win 29200, options [mss 1460,sackOK,TS val 449760826 ecr0,nop,wscale 9], length 0
E..<m.@.@.'"
....).X.v...\q.......r./..........
...:.......
08:22:01.494585 IP (tos 0x0, ttl 255, id 23, offset 0, flags [none], proto TCP (6), length 44)
    198.41.214.88.443 > 10.0.0.1.63350: Flags [S.], cksum 0x96c6 (correct), seq 11670, ack 2874962392, win 5840, options [mss 1460], length 0
E..,.......2.).X
......v..-..\q.`...........
08:22:01.757299 IP (tos 0x0, ttl 255, id 24, offset 0, flags [none], proto TCP (6), length 44)
    198.41.215.88.443 > 10.0.0.1.27344: Flags [S.], cksum 0xa39a (correct), seq 8468, ack 48473510, win 5840, options [mss 1460], length 0
E..,.......1.).X
.....j...!.....`...........
08:22:02.506616 IP (tos 0x0, ttl 64, id 27928, offset 0, flags [DF], proto TCP (6), length 60)
    10.0.0.1.63350 > 198.41.214.88.443: Flags [S], cksum 0x2c0a (correct), seq 2874962391, win 29200, options [mss 1460,sackOK,TS val 449761836 ecr0,nop,wscale 9], length 0
E..<m.@.@.'!
....).X.v...\q.......r.,
.........
...,.......
08:22:02.506803 IP (tos 0x0, ttl 255, id 25, offset 0, flags [none], proto TCP (6), length 44)
    198.41.214.88.443 > 10.0.0.1.63350: Flags [S.], cksum 0x96c6 (correct), seq 11670, ack 2874962392, win 5840, options [mss 1460], length 0
E..,.......0.).X
......v..-..\q.`...........
08:22:04.264630 IP (tos 0x0, ttl 255, id 26, offset 0, flags [none], proto TCP (6), length 44)
    198.41.214.88.443 > 10.0.0.1.63350: Flags [S.], cksum 0x96c6 (correct), seq 11670, ack 2874962392, win 5840, options [mss 1460], length 0
E..,......./.).X
......v..-..\q.`...........
08:22:04.693421 IP (tos 0x0, ttl 64, id 27929, offset 0, flags [DF], proto TCP (6), length 60)
    10.0.0.1.63350 > 198.41.214.88.443: Flags [S], cksum 0x2384 (correct), seq 2874962391, win 29200, options [mss 1460,sackOK,TS val 449764018 ecr0,nop,wscale 9], length 0
E..<m.@.@.'
....).X.v...\q.......r.#..........
...........
08:22:04.693612 IP (tos 0x0, ttl 255, id 27, offset 0, flags [none], proto TCP (6), length 44)
    198.41.214.88.443 > 10.0.0.1.63350: Flags [S.], cksum 0x96c6 (correct), seq 11670, ack 2874962392, win 5840, options [mss 1460], length 0
E..,.........).X
......v..-..\q.`...........
08:22:09.279928 IP (tos 0x0, ttl 255, id 28, offset 0, flags [none], proto TCP (6), length 44)
    104.16.25.88.443 > 10.0.0.1.46232: Flags [S.], cksum 0x421d (correct), seq 10062, ack 3429501364, win 5840, options [mss 1460], length 0
E..,......0Gh..X
.........'N.j	.`...B.......
^C
23 packets captured
23 packets received by filter
0 packets dropped by kernel
```

**Comment by zfl9** [comment]
However, I checked this file. He originally was 0.
Is there any reason to cause this problem?

**Comment by ambrop72** [comment]
Ah, actually you need to set it to 2 to disable it rather than 0.

**Comment by zfl9** [comment]
Thank you very much, the problem is solved, you can ask, why should we turn off the source address inspection?

**Comment by ambrop72** [comment]
Read about rp_filter online. The problem is with you using the interface option in curl, which means that replies from the remote host will come from the interface where normally packets to that host would not be routed through.

**Comment by frankleslie** [comment]
I have a similar problem.

I do
```
$ sudo ip tuntap add dev tun0 mode tun user root
$ sudo ip addr add dev tun0 10.0.0.1/24
$ sudo ip link set dev tun0 up

$ sudo $ tun2socks --tundev tun0 --netif-ipaddr 10.0.0.2 --netif-netmask 255.255.255.0 --socks-server-addr 127.0.0.1:1080 --loglevel 5
```

```
$ sudo ip addr
...
3: tun0: <POINTOPOINT,MULTICAST,NOARP,UP,LOWER_UP> mtu 1500 qdisc fq_codel state UP group default qlen 500
    link/none 
    inet 10.0.0.1/24 scope global tun0
       valid_lft forever preferred_lft forever
    inet6 fe80::181d:7747:1a6a:5aa/64 scope link stable-privacy 
       valid_lft forever preferred_lft forever

$ ip route
default via PROV_IP dev enp3s0 proto dhcp metric 100 
PROV_NET/24 dev enp3s0 proto kernel scope link src PROV_NET_224 metric 100 
10.0.0.0/24 dev tun0 proto kernel scope link src 10.0.0.1 
```

```
$ sudo sysctl -a | grep rp_filter
net.ipv4.conf.all.arp_filter = 2
net.ipv4.conf.all.rp_filter = 2
net.ipv4.conf.default.arp_filter = 2
net.ipv4.conf.default.rp_filter = 2
net.ipv4.conf.enp3s0.arp_filter = 2
net.ipv4.conf.enp3s0.rp_filter = 2
net.ipv4.conf.lo.arp_filter = 2
net.ipv4.conf.lo.rp_filter = 2
net.ipv4.conf.tun0.arp_filter = 2
net.ipv4.conf.tun0.rp_filter = 2

```

```
$ ping 10.0.0.2
PING 10.0.0.2 (10.0.0.2) 56(84) bytes of data.
64 bytes from 10.0.0.2: icmp_seq=1 ttl=255 time=0.160 ms
64 bytes from 10.0.0.2: icmp_seq=2 ttl=255 time=0.151 ms
64 bytes from 10.0.0.2: icmp_seq=3 ttl=255 time=0.146 ms
64 bytes from 10.0.0.2: icmp_seq=4 ttl=255 time=0.173 ms

```
after
```
$ ping -I tun0 8.8.8.8
PING 8.8.8.8 (8.8.8.8) from 10.0.0.1 tun0: 56(84) bytes of data.
^C
--- 8.8.8.8 ping statistics ---
9 packets transmitted, 0 received, 100% packet loss, time 8200ms


$  tcpdump -i tun0 -Annvvv
2:59:17.554086 IP (tos 0x0, ttl 64, id 6242, offset 0, flags [DF], proto ICMP (1), length 84)
    10.0.0.1 > 8.8.8.8: ICMP echo request, id 5, seq 4, length 64
E..T.b@.@..7
................D|^....Ht...................... !"#$%&'()*+,-./01234567
12:59:18.577996 IP (tos 0x0, ttl 64, id 7038, offset 0, flags [DF], proto ICMP (1), length 84)
    10.0.0.1 > 8.8.8.8: ICMP echo request, id 5, seq 5, length 64
E..T.~@.@...
.........G......D|^............................ !"#$%&'()*+,-./01234567
12:59:19.601895 IP (tos 0x0, ttl 64, id 7166, offset 0, flags [DF], proto ICMP (1), length 84)
    10.0.0.1 > 8.8.8.8: ICMP echo request, id 5, seq 6, length 64
E..T..@.@...
..........O.....D|^...../       ..................... !"#$%&'()*+,-./01234567
12:59:20.626912 IP (tos 0x0, ttl 64, id 8062, offset 0, flags [DF], proto ICMP (1), length 84)
    10.0.0.1 > 8.8.8.8: ICMP echo request, id 5, seq 7, length 64
E..T.~@.@...
.........0......D|^......       ..................... !"#$%&'()*+,-./01234567
12:59:21.649898 IP (tos 0x0, ttl 64, id 8163, offset 0, flags [DF], proto ICMP (1), length 84)
    10.0.0.1 > 8.8.8.8: ICMP echo request, id 5, seq 8, length 64
E..T..@.@...
.........j......D|^......       ..................... !"#$%&'()*+,-./01234567
12:59:22.673959 IP (tos 0x0, ttl 64, id 8533, offset 0, flags [DF], proto ICMP (1), length 84)
    10.0.0.1 > 8.8.8.8: ICMP echo request, id 5, seq 9, length 64
E..T!U@.@..C
.........v3...  .D|^.....H
..................... !"#$%&'()*+,-./01234567
13:00:03.545657 IP (tos 0x0, ttl 64, id 17986, offset 0, flags [DF], proto ICMP (1), length 84)
    10.0.0.1 > 8.8.8.8: ICMP echo request, id 6, seq 1, length 64
E..TFB@.@..V
.........v/.....D|^....[S...................... !"#$%&'()*+,-./01234567
13:00:04.594091 IP (tos 0x0, ttl 64, id 18238, offset 0, flags [DF], proto ICMP (1), length 84)
    10.0.0.1 > 8.8.8.8: ICMP echo request, id 6, seq 2, length 64
E..TG>@.@..Z
.........Iq.....D|^......       ..................... !"#$%&'()*+,-./01234567
13:00:05.617968 IP (tos 0x0, ttl 64, id 19068, offset 0, flags [DF], proto ICMP (1), length 84)
    10.0.0.1 > 8.8.8.8: ICMP echo request, id 6, seq 3, length 64
E..TJ|@.@...
................D|^.....m       ..................... !"#$%&'()*+,-./01234567
13:00:06.641982 IP (tos 0x0, ttl 64, id 19255, offset 0, flags [DF], proto ICMP (1), length 84)
    10.0.0.1 > 8.8.8.8: ICMP echo request, id 6, seq 4, length 64
E..TK7@.@..a
.........(......D|^......       ..................... !"#$%&'()*+,-./01234567
13:00:07.665979 IP (tos 0x0, ttl 64, id 19330, offset 0, flags [DF], proto ICMP (1), length 84)
    10.0.0.1 > 8.8.8.8: ICMP echo request, id 6, seq 5, length 64
E..TK.@.@...
.........oU.....D|^....\)
..................... !"#$%&'()*+,-./01234567
13:00:08.689921 IP (tos 0x0, ttl 64, id 19941, offset 0, flags [DF], proto ICMP (1), length 84)
    10.0.0.1 > 8.8.8.8: ICMP echo request, id 6, seq 6, length 64
E..TM.@.@...
................D|^......
..................... !"#$%&'()*+,-./01234567

```

tun2socks log
```
DEBUG(BReactor): epoll_wait returned 1 file descriptors
DEBUG(BReactor): Dispatching file descriptor
DEBUG(tun2socks): device: received packet
DEBUG(BReactor): Calling epoll_wait
DEBUG(BReactor): epoll_wait timed out
DEBUG(BReactor): Dispatching timer
DEBUG(tun2socks): TCP timer
DEBUG(BReactor): Calling epoll_wait
DEBUG(BReactor): epoll_wait timed out
DEBUG(BReactor): Dispatching timer
DEBUG(tun2socks): TCP timer
DEBUG(BReactor): Calling epoll_wait
DEBUG(BReactor): epoll_wait timed out
DEBUG(BReactor): Dispatching timer
DEBUG(tun2socks): TCP timer
DEBUG(BReactor): Calling epoll_wait
DEBUG(BReactor): epoll_wait timed out
DEBUG(BReactor): Dispatching timer
DEBUG(tun2socks): TCP timer
DEBUG(BReactor): Calling epoll_wait
DEBUG(BReactor): epoll_wait returned 1 file descriptors
DEBUG(BReactor): Dispatching file descriptor
DEBUG(tun2socks): device: received packet
DEBUG(BReactor): Calling epoll_wait
DEBUG(BReactor): epoll_wait timed out
DEBUG(BReactor): Dispatching timer
DEBUG(tun2socks): TCP timer
DEBUG(BReactor): Calling epoll_wait
DEBUG(BReactor): epoll_wait timed out
DEBUG(BReactor): Dispatching timer
DEBUG(tun2socks): TCP timer
DEBUG(BReactor): Calling epoll_wait
DEBUG(BReactor): epoll_wait timed out
DEBUG(BReactor): Dispatching timer
DEBUG(tun2socks): TCP timer
DEBUG(BReactor): Calling epoll_wait
DEBUG(BReactor): epoll_wait timed out
DEBUG(BReactor): Dispatching timer
DEBUG(tun2socks): TCP timer
DEBUG(BReactor): Calling epoll_wait
DEBUG(BReactor): epoll_wait returned 1 file descriptors
DEBUG(BReactor): Dispatching file descriptor
DEBUG(tun2socks): device: received packet
DEBUG(BReactor): Calling epoll_wait
DEBUG(BReactor): epoll_wait timed out
DEBUG(BReactor): Dispatching timer
DEBUG(tun2socks): TCP timer
DEBUG(BReactor): Calling epoll_wait
DEBUG(BReactor): epoll_wait timed out
DEBUG(BReactor): Dispatching timer
DEBUG(tun2socks): TCP timer
DEBUG(BReactor): Calling epoll_wait
DEBUG(BReactor): epoll_wait timed out
DEBUG(BReactor): Dispatching timer
DEBUG(tun2socks): TCP timer
DEBUG(BReactor): Calling epoll_wait
DEBUG(BReactor): epoll_wait timed out
DEBUG(BReactor): Dispatching timer
DEBUG(tun2socks): TCP timer
DEBUG(BReactor): Calling epoll_wait

```
after
```
 $ curl --interface tun0 https://github.com
^C
```
(none)

```
$  tcpdump -i tun0 -Annvvv
^C
```
(none)

tun2socks log
```
DEBUG(BReactor): Calling epoll_wait
DEBUG(BReactor): epoll_wait timed out
DEBUG(BReactor): Dispatching timer
DEBUG(tun2socks): TCP timer
DEBUG(BReactor): Calling epoll_wait
DEBUG(BReactor): epoll_wait timed out
DEBUG(BReactor): Dispatching timer
DEBUG(tun2socks): TCP timer
DEBUG(BReactor): Calling epoll_wait
DEBUG(BReactor): epoll_wait timed out
DEBUG(BReactor): Dispatching timer
DEBUG(tun2socks): TCP timer
DEBUG(BReactor): Calling epoll_wait
DEBUG(BReactor): epoll_wait timed out
DEBUG(BReactor): Dispatching timer
DEBUG(tun2socks): TCP timer
DEBUG(BReactor): Calling epoll_wait
DEBUG(BReactor): epoll_wait timed out
DEBUG(BReactor): Dispatching timer
DEBUG(tun2socks): TCP timer
DEBUG(BReactor): Calling epoll_wait
DEBUG(BReactor): epoll_wait timed out
DEBUG(BReactor): Dispatching timer
DEBUG(tun2socks): TCP timer
DEBUG(BReactor): Calling epoll_wait
DEBUG(BReactor): epoll_wait timed out
DEBUG(BReactor): Dispatching timer
DEBUG(tun2socks): TCP timer
DEBUG(BReactor): Calling epoll_wait
DEBUG(BReactor): epoll_wait timed out
DEBUG(BReactor): Dispatching timer
DEBUG(tun2socks): TCP timer
DEBUG(BReactor): Calling epoll_wait
```

Please, what could be the problem?

**Comment by frankleslie** [comment]
Fedora release 31 (Thirty One)
Linux 5.5.5-200.fc31.x86_64

**Comment by ambrop72** [comment]
@frankleslie
I've tried the same setup as you. "ping -I tun0 10.0.0.2" works for me, and I didn't even have to set tun0 rp_filter to 2. However, "curl --interface tun0 https://github.com" doesn't work. I captured the traffic and I saw that nothing is being sent from tun0, instead the TCP SYN packets are sent on my regular network interface, though with source address 10.0.0.1.

I don't think what you're doing is even supposed to work. The right way to use tun2socks is to create a route into tun0 that takes precedence over the existing default route by having a lower metric.

**Comment by frankleslie** [comment]
Thanks for the answer. Apparently yesterday I was doing something wrong. Today I repeated the steps and now ping -I tun0 10.0.0.2 is working.
```
ping -I tun0 10.0.0.2
PING 10.0.0.2 (10.0.0.2) from 10.0.0.1 tun0: 56(84) bytes of data.
64 bytes from 10.0.0.2: icmp_seq=1 ttl=255 time=0.113 ms
64 bytes from 10.0.0.2: icmp_seq=2 ttl=255 time=0.150 ms
64 bytes from 10.0.0.2: icmp_seq=3 ttl=255 time=0.123 ms
64 bytes from 10.0.0.2: icmp_seq=4 ttl=255 time=0.153 ms
64 bytes from 10.0.0.2: icmp_seq=5 ttl=255 time=0.146 ms
64 bytes from 10.0.0.2: icmp_seq=6 ttl=255 time=0.127 ms
64 bytes from 10.0.0.2: icmp_seq=7 ttl=255 time=0.159 ms
64 bytes from 10.0.0.2: icmp_seq=8 ttl=255 time=0.113 ms
64 bytes from 10.0.0.2: icmp_seq=9 ttl=255 time=0.106 ms
^C
--- 10.0.0.2 ping statistics ---
9 packets transmitted, 9 received, 0% packet loss, time 8231ms
```

However, ping -I tun0 8.8.8.8 still does not work.
```
$ ping -I tun0 8.8.8.8
PING 8.8.8.8 (8.8.8.8) from 10.0.0.1 tun0: 56(84) bytes of data.
^C
--- 8.8.8.8 ping statistics ---
6 packets transmitted, 0 received, 100% packet loss, time 5119ms
```

tun2socks log
```
DEBUG(BReactor): epoll_wait returned 1 file descriptors
DEBUG(BReactor): Dispatching file descriptor
DEBUG(tun2socks): device: received packet
DEBUG(BReactor): Calling epoll_wait
DEBUG(BReactor): epoll_wait timed out
DEBUG(BReactor): Dispatching timer
DEBUG(tun2socks): TCP timer
DEBUG(BReactor): Calling epoll_wait
DEBUG(BReactor): epoll_wait timed out
DEBUG(BReactor): Dispatching timer
DEBUG(tun2socks): TCP timer
DEBUG(BReactor): Calling epoll_wait
DEBUG(BReactor): epoll_wait timed out
DEBUG(BReactor): Dispatching timer
DEBUG(tun2socks): TCP timer
DEBUG(BReactor): Calling epoll_wait
DEBUG(BReactor): epoll_wait timed out
DEBUG(BReactor): Dispatching timer
DEBUG(tun2socks): TCP timer
DEBUG(BReactor): Calling epoll_wait
DEBUG(BReactor): epoll_wait returned 1 file descriptors
DEBUG(BReactor): Dispatching file descriptor
DEBUG(tun2socks): device: received packet
DEBUG(BReactor): Calling epoll_wait
DEBUG(BReactor): epoll_wait timed out
DEBUG(BReactor): Dispatching timer
DEBUG(tun2socks): TCP timer
DEBUG(BReactor): Calling epoll_wait
DEBUG(BReactor): epoll_wait timed out
DEBUG(BReactor): Dispatching timer
DEBUG(tun2socks): TCP timer
DEBUG(BReactor): Calling epoll_wait
DEBUG(BReactor): epoll_wait timed out
DEBUG(BReactor): Dispatching timer
DEBUG(tun2socks): TCP timer
DEBUG(BReactor): Calling epoll_wait
DEBUG(BReactor): epoll_wait timed out
DEBUG(BReactor): Dispatching timer
DEBUG(tun2socks): TCP timer
DEBUG(BReactor): Calling epoll_wait

```

tcpdump log
```
09:04:00.630701 IP (tos 0x0, ttl 64, id 255, offset 0, flags [DF], proto ICMP (1), length 84)
    10.0.0.1 > 8.8.8.8: ICMP echo request, id 19, seq 2, length 64
E..T..@.@...
.........4......_}^....m.       ..................... !"#$%&'()*+,-./01234567
09:04:01.654673 IP (tos 0x0, ttl 64, id 440, offset 0, flags [DF], proto ICMP (1), length 84)
    10.0.0.1 > 8.8.8.8: ICMP echo request, id 19, seq 3, length 64
E..T..@.@...
.........c\....._}^....=.       ..................... !"#$%&'()*+,-./01234567
09:04:02.678714 IP (tos 0x0, ttl 64, id 1176, offset 0, flags [DF], proto ICMP (1), length 84)
    10.0.0.1 > 8.8.8.8: ICMP echo request, id 19, seq 4, length 64
E..T..@.@...
.........z......_}^....$[
..................... !"#$%&'()*+,-./01234567
09:04:03.702726 IP (tos 0x0, ttl 64, id 2118, offset 0, flags [DF], proto ICMP (1), length 84)
    10.0.0.1 > 8.8.8.8: ICMP echo request, id 19, seq 5, length 64
E..T.F@.@..S
................_}^......
..................... !"#$%&'()*+,-./01234567
09:04:04.726732 IP (tos 0x0, ttl 64, id 2403, offset 0, flags [DF], proto ICMP (1), length 84)
    10.0.0.1 > 8.8.8.8: ICMP echo request, id 19, seq 6, length 64
E..T    c@.@..6
..........?....._}^............................ !"#$%&'()*+,-./01234567

```

If I add 10.0.0.2 the default route, the connection with my proxy is broken
```
$ ip r
default via 10.0.0.2 dev tun0 metric 99 
default via PROV_IP dev enp3s0 proto dhcp metric 100 
PROV_NET/24 dev enp3s0 proto kernel scope link src PROV_NET_224 metric 100 
10.0.0.0/24 dev tun0 proto kernel scope link src 10.0.0.1
```

**Comment by frankleslie** [comment]
And this option also does not work

```
$ ip r
default via PROV_IP dev enp3s0 proto dhcp metric 100 
PROV_NET/24 dev enp3s0 proto kernel scope link src PROV_NET_224 metric 100 
10.0.0.0/24 dev tun0 proto kernel scope link src 10.0.0.1 metric 50 


$ ping -I tun0 8.8.8.8
PING 8.8.8.8 (8.8.8.8) from 10.0.0.1 tun0: 56(84) bytes of data.
^C
--- 8.8.8.8 ping statistics ---
13 packets transmitted, 0 received, 100% packet loss, time 12268ms
```

**Comment by frankleslie** [comment]
I made the default route 10.0.0.2 and added a static route to my proxy. But somehow this didn't work either

```
09:35:42.774872 IP (tos 0x0, ttl 64, id 31554, offset 0, flags [DF], proto ICMP (1), length 84)
    10.0.0.1 > 8.8.8.8: ICMP echo request, id 33, seq 8, length 64
E..T{B@.@..V
.........ul.!..~f}^............................ !"#$%&'()*+,-./01234567
09:35:43.278194 IP (tos 0x0, ttl 64, id 23784, offset 0, flags [DF], proto UDP (17), length 63)
    10.0.0.1.36218 > 178.49.132.66.53: [udp sum ok] 35801+ A? spotssh.com.cn.ru. (35)
E..?\.@.@..Q
....1.B.z.5.+./.............spotssh.com.cn.ru.....
09:35:43.281872 IP (tos 0x0, ttl 64, id 23787, offset 0, flags [DF], proto UDP (17), length 71)
    10.0.0.1.44777 > 178.49.132.66.53: [udp sum ok] 64363+ A? adservice.google.ru.cn.ru. (43)
E..G\.@.@..F
....1.B...5.3...k..........     adservice.google.ru.cn.ru.....
09:35:43.283729 IP (tos 0x0, ttl 64, id 23788, offset 0, flags [DF], proto UDP (17), length 72)
    10.0.0.1.46087 > 178.49.132.66.53: [udp sum ok] 47408+ A? adservice.google.com.cn.ru. (44)
E..H\.@.@..D
....1.B...5.4...0..........     adservice.google.com.cn.ru.....
09:35:43.798726 IP (tos 0x0, ttl 64, id 32410, offset 0, flags [DF], proto ICMP (1), length 84)
    10.0.0.1 > 8.8.8.8: ICMP echo request, id 33, seq 9, length 64
E..T~.@.@...
.........F..!.  .f}^...../...................... !"#$%&'()*+,-./01234567
09:35:43.998008 IP (tos 0x0, ttl 64, id 24164, offset 0, flags [DF], proto UDP (17), length 74)
    10.0.0.1.39652 > 178.49.132.66.53: [udp sum ok] 37465+ A? qa.sockets.stackexchange.com. (46)
E..J^d@.@...
....1.B...5.6...Y...........qa.sockets.stackexchange.com.....
09:35:44.822813 IP (tos 0x0, ttl 64, id 33165, offset 0, flags [DF], proto ICMP (1), length 84)
    10.0.0.1 > 8.8.8.8: ICMP echo request, id 33, seq 10, length 64
E..T..@.@...
.........,..!.
.f}^............................ !"#$%&'()*+,-./01234567
09:35:44.995734 IP (tos 0x0, ttl 64, id 36617, offset 0, flags [DF], proto UDP (17), length 74)
    10.0.0.1.60902 > 178.49.132.67.53: [udp sum ok] 62118+ A? qa.sockets.stackexchange.com. (46)
E..J.   @.@.k$
....1.C...5.6...............qa.sockets.stackexchange.com.....
09:35:45.295411 IP (tos 0x0, ttl 64, id 25106, offset 0, flags [DF], proto UDP (17), length 70)
    10.0.0.1.43939 > 178.49.132.66.53: [udp sum ok] 12671+ A? www.google-analytics.com. (42)
E..Fb.@.@.. 
....1.B...5.2061............www.google-analytics.com.....
09:35:45.302872 IP (tos 0x0, ttl 64, id 25111, offset 0, flags [DF], proto UDP (17), length 74)
    10.0.0.1.38384 > 178.49.132.66.53: [udp sum ok] 13258+ A? partner.googleadservices.com. (46)
E..Jb.@.@...
....1.B...5.6}.3............partner.googleadservices.com.....
09:35:45.304661 IP (tos 0x0, ttl 64, id 25113, offset 0, flags [DF], proto UDP (17), length 60)
    10.0.0.1.42407 > 178.49.132.66.53: [udp sum ok] 53150+ A? www.google.com. (32)
E..<b.@.@..#
....1.B...5.(...............www.google.com.....
09:35:45.381960 IP (tos 0x0, ttl 64, id 25138, offset 0, flags [DF], proto UDP (17), length 75)
    10.0.0.1.56130 > 178.49.132.66.53: [udp sum ok] 13253+ A? pagead2.googlesyndication.com. (47)
E..Kb2@.@...
....1.B.B.5.7..3............pagead2.googlesyndication.com.....
09:35:45.846776 IP (tos 0x0, ttl 64, id 33459, offset 0, flags [DF], proto ICMP (1), length 84)
    10.0.0.1 > 8.8.8.8: ICMP echo request, id 33, seq 11, length 64
E..T..@.@...
..........P.!...f}^............................ !"#$%&'()*+,-./01234567
09:35:45.956363 IP (tos 0x0, ttl 64, id 36902, offset 0, flags [DF], proto UDP (17), length 63)
    10.0.0.1.56240 > 178.49.132.67.53: [udp sum ok] 30859+ A? angrygun.ru.cn.ru. (35)
E..?.&@.@.j.

```
